{
  "schema_version": "1.0",
  "source_event_id": "cam01-20260625-101422",
  "source_id": "cam01-north-drive",
  "captured_at": "2026-06-25T17:14:22Z",
  "claim_type": "ambiguous_fire_signature",
  "confidence": 0.45,
  "frame_reference": "/safezone/internal/frames/cam01-20260625-101422.jpg",
  "hazard_region": {
    "bbox": [10, 50, 100, 120],
    "label": "smoke_or_fog"
  },
  "review_required": true,
  "export_allowed": false,
  "retention": "7_days",
  "notes": "Low confidence smoke detection."
}
